{
  "detection_provider": {
    "provider": "openai",
    "model": "gpt-3.5-turbo"
  },
  "providers": {
    "openai": {
      "type": "openai",
      "api_key": "${OPENAI_API_KEY}",
      "base_url": "https://api.openai.com/v1"
    }
  },
  "knowledge_bases": {
    "product_docs": {
      "type": "chromadb",
      "url": "http://localhost:5006",
      "collection": "product_documentation",
      "embedding_provider": "openai",
      "embedding_model": "text-embedding-3-small"
    }
  },
  "strategies": [
    {
      "name": "KNOWLEDGE",
      "detection": {
        "type": "rag",
        "knowledge_base": "product_docs",
        "threshold": 0.2,
        "description": "if it's a question about our product documentation, features, or technical information"
      },
      "response": {
        "provider": "openai",
        "model": "gpt-4o-mini",
        "max_tokens": 400,
        "system_prompt": "You are a helpful product assistant. Use the provided context from our knowledge base to give accurate, detailed answers about our product features and documentation."
      }
    },
    {
      "name": "GENERAL",
      "detection": {
        "type": "default"
      },
      "response": {
        "max_tokens": 0,
        "static_response": "I don't have specific information about that topic in my knowledge base. I can help you with questions about our product features and documentation though!"
      }
    }
  ]
}